{
  "@context": "https://w3id.org/intellicat/caveat/vocabularies/profiles/assessment-1.jsonld",
  "profile": "caveat-assessment/1",
  "caveat_version": "0.4.0",
  "document": "https://doi.org/10.5555/caveat.example.2",
  "claimed_topic": "caveatoa:T11636",
  "assessments": [
    {
      "mode": "caveat:CitationManipulation",
      "score": 0.83,
      "observations": [
        {
          "marker": "caveat:CitationPatternAnomaly",
          "link": "caveat:evidence_CitationPatternAnomaly_CitationManipulation",
          "strength": "caveat:DefinitiveEvidence",
          "confidence": 1.0,
          "calibrated": true,
          "intensity": 0.83,
          "topic_relation_counts": {
            "caveat:SameTopic": 41,
            "caveat:SameSubfield": 37,
            "caveat:SameField": 9,
            "caveat:DifferentDomain": 13
          },
          "detector": {
            "pipeline": "example-citation-network",
            "module": "citation-anomaly-scorer",
            "version": "1.0"
          },
          "locator": {
            "flagged_references": 100
          }
        }
      ]
    }
  ]
}
